name,description,food_com_id,contributer_id,submitted_date,tags,nutrition,cook_time_minutes,cook_steps,ingredients,ingredient_quantities,ingredient_units,serving_size,n_steps,n_ingredients,ingredients_scraped
jiffy roasted corn and jalapeno cornbread,"this is a moist, easy, colorful and delicious cornbread. roasting the corn adds a little nuttier flavor and the red bell pepper adds a nice color and flavor.",108414,29506,2005-01-15,"['60-minutes-or-less', 'time-to-make', 'course', 'main-ingredient', 'preparation', 'occasion', 'breads', 'side-dishes', 'vegetables', 'easy', 'beginner-cook', 'comfort-food', 'inexpensive', 'corn', 'taste-mood']","[400.2, 32.0, 43.0, 31.0, 21.0, 54.0, 14.0]",35,"['melt butter in a saut pan', 'add the corn , onion and red pepper and saut on medium heat until some of the corn kernels start to turn golden brown', 'whisk egg , corn liquid , and cream together', 'stir into corn muffin mix with a fork', 'stir in diced jalapenos and cheddar cheese', 'quickly stir in hot sauted corn and onion mixture , just mixing in slightly', 'pour into 8 x 8 buttered baking dish', 'bake at 350 for 15 minutes', 'remove cornbread , turn off oven , drizzle cornbread with honey and put back in hot oven for 5 minutes', 'remove from oven and let stand for 10 minutes before serving']","['whole kernel corn', 'onion', 'red bell pepper', 'butter', 'jiffy corn muffin mix', 'egg', 'heavy cream', 'jalapenos', 'sharp cheddar cheese', 'honey']","[1.0, 0.3333333333333333, 0.3333333333333333, 3.0, 1.0, 1.0, 3.0, 2.5, 1.0, 2.5]","['15 1/4 ounce', 'cup', 'cup', 'tablespoons', '8 1/2 ounce', 'unknown unit', 'tablespoons', 'tablespoons', 'cup', 'tablespoons']",6.0,10,10,"['can whole kernel corn , drained well (reserve 1/4 cup liquid)', 'diced onion', 'diced red bell pepper', 'butter', 'package Jiffy corn muffin mix', 'egg', 'heavy cream', 'diced jalapenos or 2 -3 tablespoons green chilies', 'shredded sharp cheddar cheese', 'honey (optional)']"
keep it going german friendship cake,"yes, this sounds bizarre, but it really is tasty and i have had some that was going around for months. it is a nice thing to start at work, school, church, etc. try it...it's like a chain cake instead of a chain letter :)",26995,37305,2002-04-30,"['weeknight', 'time-to-make', 'course', 'main-ingredient', 'cuisine', 'preparation', 'occasion', 'breads', 'eggs-dairy', 'fruit', 'german', '1-day-or-more', 'oven', 'european', 'refrigerator', 'potluck', 'vegetarian', 'nuts', 'eggs', 'dietary', 'gifts', 'comfort-food', 'yeast', 'quick-breads', 'tropical-fruit', 'pineapple', 'taste-mood', 'to-go', 'equipment']","[724.4, 38.0, 297.0, 20.0, 18.0, 31.0, 39.0]",14450,"['mix starter ingredients in a bowl and let stand at room temperature undisturbed for 24 to 36 hours', 'place starter in a medium bowl and combine it with the""first day"" ingredients', 'cover and refrigerate', 'stir once a day for 5 days', 'on the 5th day , place in a larger bowl and add the""fifth day"" ingredients', 'cover and refrigerate', 'stir once a day for 5 more days', 'remove 3 separate cups of starter and give each cup to 3 friends with the recipe and instructions', 'preheat oven to 350 degrees', 'combine all of the""tenth day"" ingredients with the remaining mixture', 'pour into a greased and floured 9 x 13"" pan', 'combine topping ingredients and sprinkle on top', 'bake for 40- 50 minutes']","['flour', 'water', 'dry yeast', 'milk', 'sugar', 'eggs', 'vegetable oil', 'baking soda', 'baking powder', 'salt', 'cinnamon', 'vanilla', 'crushed pineapple', 'raisins', 'nuts', 'butter', 'brown sugar']",[],[],-1.0,13,17,[]
killer lasagna,this was originally my mom's recipe and used to be a favorite when we were kids. i always requested it for my birthday dinner.,53402,60512,2003-02-04,"['weeknight', 'time-to-make', 'course', 'main-ingredient', 'cuisine', 'preparation', 'occasion', 'casseroles', 'main-dish', 'pasta', 'oven', 'european', 'potluck', 'dinner-party', 'heirloom-historical', 'holiday-event', 'italian', 'lasagna', 'dietary', 'low-carb', 'low-in-something', 'pasta-rice-and-grains', 'to-go', 'equipment', '4-hours-or-less']","[370.5, 38.0, 21.0, 57.0, 53.0, 64.0, 3.0]",90,"['brown the sausage and ground meat and drain all the fat', 'add all the other ingredients for the meat filling and simmer on the stove , uncovered , for about 1 / 2 hour', 'i usually add a bay leaf or two', 'mix up the cheese filling and set aside in fridge until ready to use', 'put the noodles in salted water and cook until soft when poked with a fork', 'when the noodles are done , drain the noodles and rinse off with cold water so they can be handled easily', 'spray the baking pan with a non-stick spray and put a layer of noodles down on the bottom of the pan', 'it is ok to cut some of the noodles to fit into the pan if they do not fit whole', 'spread half the cheese filling over the noodels , then half of the mozarella cheese on top of that , then half of the meat sauce over the grated mozarella cheese', 'repeat layers and then top with more mozarella cheese', 'bake at 375 degrees for 30 minutes', 'let stand for 10 minutes before cutting into it', 'leftovers can be easily stored in the freezer']","['italian sausage', 'ground beef', 'garlic', 'dried basil', 'salt', 'whole tomato', 'tomato paste', 'ricotta cheese', 'cottage cheese', 'parmesan cheese', 'parsley flakes', 'eggs', 'ground black pepper', 'lasagna noodle', 'mozzarella cheese']",[],[],-1.0,13,15,[]
kitchen sink egg bake,i call this ,59632,79219,2003-04-14,"['weeknight', 'time-to-make', 'course', 'main-ingredient', 'preparation', 'occasion', 'omelets-and-frittatas', 'breakfast', 'eggs-dairy', 'cheese', 'eggs', 'dietary', 'low-carb', 'inexpensive', 'low-in-something', 'brunch', '4-hours-or-less']","[794.2, 109.0, 9.0, 30.0, 59.0, 153.0, 3.0]",70,"['preheat oven to 325', 'thaw spinach , and squeeze out as much moisture as possible', 'beat the eggs in medium bowl', 'stir in the cottage cheese , grated cheese , spinach and seasonings', 'stir until mixed thoroughly', 'lightly spray glass 13x9 pan w / olive oil or pam', 'distribute meat / chicken / ham evenly over bottom of pan', 'pour cottage cheese mixture over meat', 'push w / spatula to distribute evenly', 'top with extra grated cheese if desired', 'sprinkle top w / toasted wheat germ', 'bake 45-50 minutes , until set and slightly brown at edges', 'let sit a few minutes out of oven before serving', 'serve hot or at room temperature']","['eggs', 'cottage cheese', 'cheese', 'frozen chopped spinach', 'beef', 'salt', 'pepper', 'herbs', 'spices', 'olive oil flavored cooking spray', 'toasted wheat germ']","[6.0, 1.0, 2.0, 1.0, 2.0, -1.0, -1.0, -1.0, -1.0, -1.0, -1.0, 2.5]","['unknown unit', 'pint', 'cups', '10 ounce', 'cups', 'unknown unit', 'unknown unit', 'unknown unit', 'unknown unit', 'unknown unit', 'unknown unit', 'tablespoons']",6.0,14,11,"['eggs', 'cottage cheese (I use fat free)', 'grated cheese , of choice (I like Swiss best)', 'package frozen chopped spinach', 'cooked beef or 2 cups cooked chicken, bite-size', 'salt', 'pepper', 'herbs', 'spices (see below)', 'olive oil flavored cooking spray or Pam cooking spray', 'more grated cheese , for top,if desired', 'toasted wheat germ']"
land of nod cinnamon buns,"i have made this several times and it's dead easy. if you have overnight guests, what could be easier for breakfast? i've made it on special occasions, too, such as easter morning and christmas morning, etc. this recipe comes from the best of bridge series.",22526,29212,2002-03-14,"['60-minutes-or-less', 'time-to-make', 'course', 'preparation', 'breakfast', 'oven', 'easy', 'dietary', 'equipment']","[575.3, 18.0, 116.0, 34.0, 28.0, 22.0, 34.0]",35,"['before you turn in for the night , grease a 10"" bundt pan and add frozen rolls', 'sprinkle with brown sugar , pudding powder , cinnamon and raisins', 'pour melted butter over all', 'cover with a clean , damp cloth', 'off to bed you go !', 'in the morning , preheat oven to 350 and bake for 25 minutes', 'let sit for 5 minutes and then turn out on a serving plate']","['rolls', 'brown sugar', 'instant vanilla pudding', 'cinnamon', 'raisins', 'butter']","[20.0, 1.0, 0.25, 1.5, 0.75, -1.0]","['unknown unit', 'cup', 'cup', 'tablespoon', 'cup', 'cup']",9.0,7,6,"['frozen dough rolls', 'brown sugar', 'instant vanilla pudding', 'cinnamon', 'raisins (optional)', 'melted butter']"
leftovers spaghetti sauce,"i love eating ground beef in my spaghetti sauce. here's another recipe i made up, this time with leftovers i had in the fridge and also what i had on hand in the pantry. we were on a tight budget at the time, so i just threw a bunch of stuff together and it came out quite good and my husband enjoyed it too again, my measurements are all estimated, i apologize.",100870,164610,2004-09-29,"['60-minutes-or-less', 'time-to-make', 'course', 'main-ingredient', 'preparation', 'for-1-or-2', 'healthy', 'sauces', 'main-dish', 'condiments-etc', 'beef', 'pasta', 'dietary', 'low-cholesterol', 'low-calorie', 'low-carb', 'healthy-2', 'ground-beef', 'low-in-something', 'meat', 'pasta-rice-and-grains', 'number-of-servings']","[987.8, 75.0, 195.0, 106.0, 104.0, 83.0, 28.0]",40,"[""i had previously browned and drained the ground beef and had it in the fridge , if you don't have this leftover , brown ground beef first in a nonstick skillet , drain off fat really well"", 'i use a pile of paper towels to soak up the fat', 'place ground beef in a large pot', 'stir in all other ingredients except the sugar', 'bring to a boil , stirring occasionally', 'turn heat down to low and simmer uncovered or covered for about 30 minutes or so to let the flavors mix , stirring occasionally', 'taste the sauce now and then and add more onions or garlic to taste', 'add a little sugar to neutralize the acidity of the tomatoes during the simmering', 'serve over hot spaghetti noodles', 'the sauce should be fairly thick , not runny , so as you add in the ingredients , use more or less of the prego as needed', 'if too thick , add a little water , more prego , or more stewed tomatoes with juice', 'when i made mine , it was the consistency of chili', 'this makes a pretty decent batch , can feed 2-4 depending on how much everyone eats in a serving']","['stewed tomatoes', 'prego spaghetti sauce', 'garlic', 'ground beef', 'white onion', 'granulated sugar']","[1.0, 1.0, 2.0, 1.0, 0.5, 2.0]","['24 ounce', '26 ounce', 'clove', 'lb', 'unknown unit', 'teaspoon']",3.0,13,6,"['can stewed tomatoes , undrained', 'jar Prego spaghetti sauce, your choice of flavor (tomato, green pepper and onion flavor is the kind i had on hand. Also try tomato, onion, and garlic)', 'garlic , chopped fine', 'browned ground beef', 'small white onion, chopped', 'granulated sugar']"
love is in the air beef fondue sauces,i think a fondue is a very romantic casual dinner or wonderful for after the theatre snack served with a robust red wine. for dinner serve with rice & a small salad. almond rice pilaf is a great accompaniment (recipe posted separately ) to cook the meat you must first heat your oil - i do this by heating it to almost boiling on the stove and then transfering it to your fondue burner. buy good quality meat i recommend only using a fillet. have at least 3 sauces. if you want to serve 4-6 people just increase the meat to 2 lbs there will be enough sauce.these sauce recipes came from ,84797,4470,2004-02-23,"['30-minutes-or-less', 'time-to-make', 'course', 'main-ingredient', 'preparation', 'occasion', 'for-1-or-2', 'sauces', 'appetizers', 'main-dish', 'condiments-etc', 'beef', 'dinner-party', 'holiday-event', 'dietary', 'valentines-day', 'savory-sauces', 'meat', 'number-of-servings']","[1615.2, 154.0, 323.0, 74.0, 182.0, 193.0, 30.0]",25,"['honey mustard sauce: whisk all the ingredients together serve warm or cold', 'easy bbq sauce: combine all ingredients in a pot& cook over low heat until the sugar is dissolved', 'serve warm or cold', 'garlic dill sauce: mix all the ingredients and chill until ready to serve']","['beef steaks', 'vegetable oil', 'spicy mustard', 'fresh lemon juice', 'honey', 'brown sugar', 'ketchup', 'hot sauce', 'sour cream', 'fresh garlic', 'fresh parsley', 'dried dill weed']",[],[],-1.0,4,12,[]
make it your way shortcakes,"top with freshly sliced strawberries and whipped cream to create a classic summertime dessert. again, you can play around with different toppings a verytime you bake these cakes. wonderful !",35653,6164,2002-07-29,"['30-minutes-or-less', 'time-to-make', 'course', 'preparation', 'occasion', 'breads', 'desserts', 'easy', 'beginner-cook', 'fall', 'heirloom-historical', 'holiday-event', 'kid-friendly', 'picnic', 'romantic', 'spring', 'summer', 'winter', 'cakes', 'dietary', 'gifts', 'christmas', 'new-years', 'seasonal', 'comfort-food', 'independence-day', 'ramadan', 'valentines-day', 'taste-mood', 'to-go', 'number-of-servings']","[175.2, 11.0, 15.0, 8.0, 7.0, 21.0, 7.0]",25,"['pre-heat the oven to 450', 'sift together the flour , salt and baking powder', 'mix in the sugar', 'cut in the butter with a fork until meal-like crumbs form', 'lightly beat the egg in a separate bowl', 'add the milk', 'add to the flour mixture', 'briefly knead on a floured board', 'roll out to 1 / 2 inch thick', 'cut into 2"" squares', 'place on a greased baking sheet and cook for 10 minutes']","['flour', 'salt', 'baking powder', 'sugar', 'butter', 'egg', 'milk']","[2.0, 0.5, 1.0, 3.0, 0.3333333333333333, 1.0, 0.5]","['cups', 'teaspoon', 'teaspoon', 'tablespoons', 'cup', 'unknown unit', 'cup']",10.0,11,7,"['flour', 'salt', 'baking powder', 'sugar', 'butter', 'egg', 'milk']"
make that chicken dance salsa pasta,"i made this up the other night after i started to make mirjam's penne arrabiatta (#22941) but discovered i was missing a few ingredients. like the italian dish i meant to make, this one is also spicy and loaded with garlic. i'm sure it would be even more flavourful with fresh herbs, but dried ones were all i had on hand.",32169,27678,2002-06-25,"['30-minutes-or-less', 'time-to-make', 'course', 'main-ingredient', 'preparation', 'occasion', 'for-1-or-2', 'healthy', 'main-dish', 'pasta', 'poultry', 'vegetables', 'easy', 'chicken', 'stove-top', 'dietary', 'spicy', 'low-sodium', 'low-cholesterol', 'low-saturated-fat', 'low-calorie', 'low-carb', 'healthy-2', 'low-in-something', 'meat', 'chicken-breasts', 'pasta-rice-and-grains', 'taste-mood', 'equipment', 'number-of-servings']","[255.2, 18.0, 39.0, 18.0, 39.0, 13.0, 6.0]",30,"['heat oil in a frying pan and saut the onions and mushrooms until soft , about two minutes', 'add the water , tomatoes , garlic , oregano , basil , parsley and hot sauce', 'simmer over low heat for 6-10 minutes or until tomatoes are soft and enough water has evaporated to form a relatively thick sauce', 'add salsa and chicken', 'simmer until heated through', 'cook pasta of your choice until al dente', 'serve sauce over hot pasta , top with parmesan cheese and freshly ground black pepper']","['tomatoes', 'garlic', 'onion', 'button mushrooms', 'hot sauce', 'dried oregano', 'dried basil', 'fresh parsley', 'water', 'salsa', 'chicken breasts', 'olive oil', 'fresh ground black pepper', 'parmesan cheese', 'pasta']","[4.5, 3.0, 1.0, 3.5, 1.0, 1.0, 1.0, 1.0, 0.125, 0.25, 1.0, 2.0, -1.0, -1.0, -1.0]","['unknown unit', 'cloves', 'unknown unit', 'unknown unit', 'tablespoon', 'tablespoon', 'tablespoon', 'tablespoon', 'cup', 'cup', 'unknown unit', 'teaspoons', 'unknown unit', 'unknown unit', 'unknown unit']",2.5,7,15,"['fresh and juicy tomatoes , chopped (preferrably vine-ripened)', 'garlic , minced', 'small onion , chopped', 'large button mushrooms , sliced', 'hot sauce', 'dried oregano', 'dried basil', 'fresh parsley', 'water', 'of your favourite cooked salsa', 'chicken breasts , cooked and diced or 1 cup quorn pieces (vegetarian substitute)', 'olive oil', 'fresh ground black pepper', 'parmesan cheese', 'pasta']"
marijuana vinegar,"stefan and emily used to make this stuff when her herb garden was overly productive. the last batch i made was with a blend of thyme, summer savoury, basil, oregano and a bay leaf.",24478,32692,2002-04-08,"['weeknight', 'time-to-make', 'course', 'cuisine', 'preparation', 'occasion', 'for-large-groups', '5-ingredients-or-less', 'condiments-etc', '1-day-or-more', 'easy', 'european', 'no-cook', 'vegetarian', 'dietary', 'gifts', 'spicy', 'gluten-free', 'oamc-freezer-make-ahead', 'inexpensive', 'cooking-mixes', 'free-of-something', 'taste-mood', 'number-of-servings', 'technique']","[3.1, 0.0, 0.0, 0.0, 0.0, 0.0, 0.0]",20160,"['mix the herbs and vinegar together in a jar', 'seal and leave in a warm place for 2 weeks , shaking often', 'strain the vinegar through cheesecloth and then through coffee filter paper', 'pour into sterilised bottles and add 2-3 sprigs of fresh herb to each bottle', 'seal with acid-proof lids or bottle tops']","['fresh herbs', 'cider vinegar', 'fresh herb']","[5.5, 24.0, -1.0]","['ounces', 'unknown unit', 'unknown unit']",24.0,5,3,"['fresh herbs , finely chopped', 'fluid ounces cider vinegar or 24 fluid ounces balsamic vinegar', 'fresh herb , for bottling']"
mennonite corn fritters,"ok - my heritage has been revealed. :) these are simply wonderful. a favorite among our community, they're sure to bring a smile to your face. enjoy!",44045,41706,2002-10-25,"['15-minutes-or-less', 'time-to-make', 'course', 'main-ingredient', 'cuisine', 'preparation', 'occasion', 'north-american', 'side-dishes', 'vegetables', 'american', 'easy', 'diabetic', 'dinner-party', 'heirloom-historical', 'holiday-event', 'kid-friendly', 'vegetarian', 'stove-top', 'dietary', 'christmas', 'thanksgiving', 'comfort-food', 'amish-mennonite', 'northeastern-united-states', 'corn', 'taste-mood', 'equipment', 'number-of-servings']","[67.1, 7.0, 2.0, 7.0, 3.0, 10.0, 1.0]",15,"['combine eggs , flour , baking powder , salt& pepper with the corn', 'mix thoroughly', 'add cream to mixture', 'melt fat in frying pan& drop corn mixture by spoonfuls into the hot fat', 'brown on both sides', 'serve w / syrup']","['fresh corn', 'eggs', 'flour', 'salt', 'pepper', 'baking powder', 'cream', 'fat']","[2.0, 2.0, 0.25, 1.0, 0.125, 1.0, 2.0, 4.0]","['cups', 'unknown unit', 'cup', 'teaspoon', 'teaspoon', 'teaspoon', 'tablespoons', 'tablespoons']",17.0,6,8,"['fresh corn or 2 cups canned corn (creamed or kernel)', 'eggs , beaten', 'flour', 'salt', 'pepper', 'baking powder', 'cream', 'fat (butter, oil or margarine)']"
mexican pasta,made this as a side dish for mexican meatballs (#58471)because my oldest won't do rice. even she liked it!,60219,76846,2003-04-18,"['30-minutes-or-less', 'time-to-make', 'course', 'main-ingredient', 'cuisine', 'preparation', 'north-american', 'healthy', 'side-dishes', 'pasta', 'mexican', 'easy', 'low-fat', 'dietary', 'inexpensive', 'low-in-something', 'pasta-rice-and-grains']","[325.3, 10.0, 11.0, 39.0, 26.0, 17.0, 17.0]",25,"['boil pasta as directed on package', 'drain and put in large serving bowl', 'mix picante sauce , milk , and cheese soup in a smaller bowl until creamy', 'heat in microwave until warm', 'mix sauce and pasta together and garnish with olives and jalepenos if desired']","['fettuccine pasta', 'cheddar cheese soup', 'milk', 'picante sauce', 'black olives', 'jalapeno']","[1.0, 1.0, 0.5, 2.0, -1.0, -1.0]","['16 ounce', 'can', 'cup', 'cups', 'unknown unit', 'unknown unit']",7.0,5,6,"['package fettuccine pasta', 'cheddar cheese soup', 'milk', 'picante sauce', 'sliced black olives (optional)', 'chopped jalapeno (optional)']"
mock a mole low fat guacamole,from crescent dragonwagon's ,81185,67026,2004-01-15,"['15-minutes-or-less', 'time-to-make', 'course', 'main-ingredient', 'cuisine', 'preparation', 'occasion', 'north-american', 'healthy', 'appetizers', 'vegetables', 'american', 'southwestern-united-states', 'potluck', 'picnic', 'vegan', 'vegetarian', 'dips', 'dietary', 'low-cholesterol', 'low-saturated-fat', 'low-calorie', 'healthy-2', 'low-in-something', 'to-go', 'presentation', 'served-cold']","[115.9, 7.0, 21.0, 19.0, 9.0, 3.0, 5.0]",15,"['thaw peas by running hot water over them in a strainer until they are bright green', 'puree peas in food processor', 'add 1 / 4 of one avocado , salt , and juice of one lemon or lime', 'puree again and transfer to a bowl', 'coarsely mash the remaining avocado and stir in tomato and onion', 'taste and add more salt / lemon to your taste', 'stir in cilantro']","['frozen peas', 'hass avocado', 'salt', 'lemons, juice of', 'tomatoes', 'onion', 'cilantro']","[1.0, 1.5, 1.0, 2.0, 1.0, 0.5, 2.0]","['16 ounce', 'unknown unit', 'teaspoon', 'unknown unit', 'unknown unit', 'unknown unit', 'tablespoons']",6.0,7,7,"['bag frozen peas', 'ripe Hass avocado (peeled and pitted)', 'salt', 'lemons, juice of or 1 -3 lime, juice of', 'tomatoes , diced', 'onion , finely diced', 'minced cilantro']"
momma s special marinade,we usually use with chicken. my neices ask for this by name ,30131,41480,2002-06-03,"['15-minutes-or-less', 'time-to-make', 'course', 'cuisine', 'preparation', 'occasion', 'north-american', 'for-1-or-2', 'low-protein', 'condiments-etc', 'american', 'barbecue', 'easy', 'diabetic', 'holiday-event', 'kid-friendly', 'summer', 'marinades-and-rubs', 'dietary', 'seasonal', 'low-carb', 'independence-day', 'low-in-something', 'equipment', 'grilling', 'number-of-servings']","[199.2, 31.0, 6.0, 10.0, 1.0, 13.0, 1.0]",10,"['depending on how much meat i have i usually have to either double or triple this recipe the longer your meat marinates the better it tastes', 'this recipe was originally for salmon , but i think it can be used universally', ""i've also used this same recipe for steak and chicken"", 'it is wonderful']","['lemon juice', 'oil', 'worcestershire sauce', 'basil', 'soy sauce', 'garlic powder', 'pepper']","[3.0, 3.0, 1.0, 1.0, 1.0, 1.0, -1.0]","['tablespoons', 'tablespoons', 'tablespoon', 'tablespoon', 'teaspoon', 'teaspoon', 'unknown unit']",2.0,4,7,"['lemon juice', 'oil', 'Worcestershire sauce', 'basil', 'soy sauce', 'garlic powder', 'pepper']"
more more apple pear jigglers,"it's a fun finger food for infants and toddlers that packs a little calcium and vitamin punch. try vegetarian cream cheese and soy yogurt for the lactose intolerant child or children not yet introduced to milk products. cook time is approximate chill time. servings are dependent on size of squares or shapes cut, but we cut the pan into 5 rows and 5 columns, yielding 25 squares.",63593,47858,2003-06-02,"['weeknight', 'time-to-make', 'main-ingredient', 'preparation', 'for-large-groups', 'low-protein', 'fruit', 'finger-food', 'kid-friendly', 'dietary', 'low-sodium', 'low-cholesterol', 'infant-baby-friendly', 'low-calorie', 'low-carb', 'toddler-friendly', 'low-in-something', 'apples', 'number-of-servings', 'presentation', '4-hours-or-less']","[22.9, 1.0, 5.0, 0.0, 1.0, 3.0, 0.0]",125,"['in a food processor or blender , process the gelatin and milk for 30 seconds or until gelatin is disolved and mixture is smooth', 'add the cream cheese and yogurt and process for 10 seconds', 'add the fruits and blend until thoroughly pured', 'spray an 8-inch square baking pan with nonstick spray', 'pour gelatin mixture into pan and chill until firm', 'once chilled , cut into squares or creative shapes using cookie cutters and serve']","['unflavored gelatin', 'milk', 'cream cheese', 'yogurt', 'apple', 'pear']","[1.0, 1.0, 2.0, 2.0, 1.0, 1.0]","['unknown unit', 'cup', 'ounces', 'ounces', 'cup', 'cup']",25.0,6,6,"['envelope unflavored gelatin', 'milk or 1 cup soymilk', 'cream cheese', 'whole fat yogurt , like stoneyfield farms yobaby (choice of flavors, but apple, banana and vanilla seem to be the best choices)', 'apple , skinned,cut into chunks and blanched', 'ripe pear , skinned,cut into chunks and blanched']"
