name,description,food_com_id,contributer_id,submitted_date,tags,nutrition,cook_time_minutes,cook_steps,ingredients,ingredient_quantities,ingredient_units,serving_size,n_steps,n_ingredients,ingredients_scraped
mr grant you took half veal prince orloff,i couldn't resist! named in honor of one of my all time favorite ,43164,28201,2002-10-14,"['weeknight', 'time-to-make', 'course', 'main-ingredient', 'cuisine', 'preparation', 'occasion', 'casseroles', 'main-dish', 'beef', 'oven', 'european', 'roast', 'dinner-party', 'romantic', 'veal', 'meat', 'taste-mood', 'equipment', '4-hours-or-less']","[510.6, 50.0, 10.0, 21.0, 90.0, 70.0, 1.0]",120,"['preheat oven to 325', 'dry the veal on paper towels', 'place in a heavy casserole just large enough to hold the veal easily', 'place the casserole over moderately high heat with the butter and oil', 'when you see the butter foam begin to subside , brown the veal lightly on all sides', 'this takes 10 to 15 minutes', 'remove the veal', 'if the browning fat has burned , pour it out and add butter', 'stir in the vegetables and herb bouquet , cover and cook over low heat for 5 minutes with out browning', 'sprinkle salt and pepper over the veal', 'return it to the casserole and baste with the butter in the casserole', 'insert meat thermometer', 'lay the blanched bacon over the meat , then cover with foil', 'cover the casserole and set in lower third of preheated oven', 'regulate heat so meat cooks slowly and steadily for about 1-1 / 2 hours', 'baste it 2 or 3 times with the juices in the casserole', ""the roast is done at a thermometer reading of 175 degrees , or as soon as it's juices run clear yellow when the meat is pricked deeply with a fork"", 'place the veal on a hot platter and discard trussing strings', 'the veal and vegetables will have produced a cup or more of juice in the casserole', 'remove all but 2 tablespoons of fat from them', 'set casserole over moderate heat while scraping up any coagulated cooking juices from the bottom and sides with a wooden spoon , and mashing the vegetables into the liquid', 'boil down rapidly if necessary', 'you should have 3 / 4 to 1 cup', 'correct seasoning , and strain into a hot gravy boat', 'garnish the meat platter with whatever vegetables you have chosen , and serve', 'if you are not serving immediately , return the veal and sauce to the casserole , cover partially , and set in a turned-off hot oven where it will stay warm for half an hour at least']","['veal roast', 'butter', 'oil', 'carrots', 'onions', 'parsley sprigs', 'bay leaf', 'thyme', 'salt', 'pepper', 'bacon']",[],[],-1.0,26,11,[]
munch without guilt tomatoes,anytime munchies...another sweat free preparation for all of you !,30300,6164,2002-06-04,"['15-minutes-or-less', 'time-to-make', 'course', 'main-ingredient', 'cuisine', 'preparation', 'occasion', 'low-protein', 'healthy', '5-ingredients-or-less', 'appetizers', 'salads', 'vegetables', 'asian', 'indian', 'easy', 'no-cook', 'beginner-cook', 'diabetic', 'dinner-party', 'holiday-event', 'kid-friendly', 'low-fat', 'picnic', 'vegetarian', 'dietary', 'low-sodium', 'low-cholesterol', 'low-saturated-fat', 'low-calorie', 'comfort-food', 'low-carb', 'healthy-2', 'low-in-something', 'taste-mood', 'to-go', 'number-of-servings', '3-steps-or-less', 'technique']","[3.0, 0.0, 1.0, 0.0, 0.0, 0.0, 0.0]",10,"['put a slice of tomato on each biscuit / cracker', 'smear with little mayo and sprinkle black pepper', 'munch without guilt !']","['tomatoes', 'crackers', 'mayonnaise', 'black pepper']","[2.0, -1.0, -1.0, -1.0]","['unknown unit', 'unknown unit', 'unknown unit', 'unknown unit']",12.0,3,4,"['big tomatoes , thinly sliced', 'plain salty crackers or biscuit', 'mayonnaise', 'black pepper']"
my muffuletta sandwich,watched a documentary about the ,78655,12875,2003-12-12,"['30-minutes-or-less', 'time-to-make', 'course', 'main-ingredient', 'cuisine', 'preparation', 'occasion', 'lunch', 'pork', 'easy', 'european', 'finger-food', 'italian', 'sandwiches', 'meat', 'novelty', 'presentation', '3-steps-or-less']","[181.1, 26.0, 6.0, 17.0, 2.0, 11.0, 2.0]",20,"['mix everything in food processor', 'chop fine for spread', 'refrigerate until ready to use']","['ciabatta', 'provolone cheese', 'genoa salami', 'ham', 'tomatoes', 'sweet onion', 'green olives', 'kalamata olive', 'fresh basil', 'capers', 'garlic', 'brine', 'oregano leaves', 'olive oil', 'red wine vinegar', 'fresh parsley', 'carrot']",[],[],-1.0,3,17,[]
never weep whipped cream,"i don't know where i got this, but it works. the whipped cream will keep for a week in the fridge without deflating... great for party make-ahead.",74805,87877,2003-11-01,"['15-minutes-or-less', 'time-to-make', 'course', 'main-ingredient', 'preparation', '5-ingredients-or-less', 'condiments-etc', 'eggs-dairy', 'easy', 'refrigerator', 'garnishes', 'equipment', 'small-appliance', 'mixer']","[276.3, 45.0, 2.0, 1.0, 3.0, 91.0, 0.0]",5,"['whip all ingredients together until firm peaks form', 'cover leftovers tightly , preferably in an air-tight plastic container', 'this stays the same consistency until used', 'it will keep for a week in the fridge without deflating']","['whipping cream', 'vanilla instant pudding mix', 'powdered sugar', 'vanilla extract']","[1.0, 2.0, 1.0, 0.5]","['pint', 'tablespoons', 'teaspoon', 'teaspoon']",4.0,4,4,"['whipping cream', 'dry vanilla instant pudding mix (fold over paper envelope it comes in and keep for future use (1 box does about 3 batches of whipped)', 'powdered sugar , more to taste for sweetened whipped cream', 'vanilla extract']"
no bake cookie crumble cheesecake,"yet another one i have not made, but have had for awhile. sounds good and very versatile as you choose what kind of cookies to use! also sounds extremely easy(not to mention quick) as you whip this all up in a blender and put into a storebought crust!! most of my cheesecake making has been baked ones so i hope this ",71635,82367,2003-09-26,"['weeknight', 'time-to-make', 'course', 'preparation', 'desserts', 'cheesecake', '4-hours-or-less']","[387.6, 39.0, 98.0, 12.0, 12.0, 67.0, 11.0]",135,"['in blender , sprinkle gelatin over cold milk', 'let stand 2 minutes', 'add hot milk and process at low until dissolved , about 2 minutes', 'add cream cheese , sugar and vanilla and process until blended', 'arrange mini chocolate chips in the bottom of the crust', 'pour in gelatin mixture', 'sprinkle with your favourite crushed cookies', 'chill until firm , about 2 hours']","['gelatin', 'milk', 'cream cheese', 'sugar', 'vanilla extract', 'miniature semisweet chocolate chips', 'prepared graham cracker crusts', 'cookie']","[1.0, 0.25, 1.0, 2.0, 0.5, 1.0, 0.5, 1.0, -1.0]","['unknown unit', 'cup', 'cup', '8 ounce', 'cup', 'teaspoon', 'cup', '9 ounce', 'unknown unit']",10.0,8,8,"['envelope gelatin (such as Knox)', 'cold milk', 'milk , heated to boiling', 'packages cream cheese , softened', 'sugar', 'vanilla extract', 'miniature semisweet chocolate chips', 'extra serving size prepared graham cracker crusts', ""your favourite cookie, coarsely crushed (Oreo's, choc. chip cookies,whatever your fancy!!)""]"
now and later vegetarian empanadas,this is from ,38276,37640,2002-08-26,"['weeknight', 'time-to-make', 'course', 'main-ingredient', 'cuisine', 'preparation', 'occasion', 'north-american', 'lunch', 'main-dish', 'vegetables', 'mexican', 'vegetarian', 'dietary', 'gifts', 'one-dish-meal', 'oamc-freezer-make-ahead', 'number-of-servings', '4-hours-or-less']","[477.1, 36.0, 24.0, 21.0, 26.0, 61.0, 18.0]",90,"['in a pot , cover carrots with water to cover', 'bring to a boil , then lower heat', 'simmer 10 minutes or until just tender', 'while simmering carrots , pour contents of can of tomatoes into a bowl and squish into little pieces with your hands', 'wash hands', 'blend chili powder , cumin , oregano , and cayenne into tomatoes', 'take the 2 tbs of flour and blend with 1 / 4 cup cold water in a small cup', 'pour this into tomato mixture and stir to blend', 'drain carrots , and cut into 3 / 4 in pieces', 'put both aside for now', 'melt butter on medium heat in a large fring pan', 'add onion , mushrooms , zucchini , celery , green pepper , and garlic and saute', 'stir continuously until onion is limp', 'stir tomato mixture into frying pan and bring to a simmer', 'cover and simmer for 2 or 3 minutes , then uncover and cook for about 5 minutes over med-high heat until liquid has evaporated', 'stir in carrots and cheese', 'salt to taste', 'when cheese has melted put pan in refrigerator to quickly cool vegetables', 'stir now and then to help cool faster', 'now , begin empanada crust', 'resift flour with baking powder in a bowl', 'quickly cut butter and shortening into bowl until it looks like a coarse meal', 'make a well in the center', 'add soy sauce and cold water together', 'stir vigorously with a fork until dough follows the fork around bowl', 'personal observation: the dough seems rather""frothy"" at this point', 'turn dough onto a lightly floured surface and knead gently for about 10 folds to remove stickyness', 'divide dough into 8 equal pieces', 'make into a ball and roll into an 8 inch circle', 'spoon about 3 / 4 cup vegetable filling onto center of circle', 'moisten edges of circle with water and bring together at top , pinching and fluting edges', 'mine looked like balls of dough and turned out fine', 'lift empanada onto ungreased cookie sheet', 'repeat until done', 'if you fill more than one cookie sheet put the full one in the refrigerator', 'when done , prick the top of each empanada with a fork and brush with egg and water mixture', 'if you are going to cook some of them right away , pre-heat oven to 400 and cook 25 to 30 minutes on an ungreased cookie sheet', 'take the ones for later and freeze uncovered on cookie sheet overnight', 'when frozen solid wrap in foil or put in freezer bags', 'label with instructions: bake uncovered in pre-heated 425 degree oven for 30 minutes', 'let cool some before serving']","['carrots', 'butter', 'onion', 'sliced mushrooms', 'zucchini', 'celery', 'green pepper', 'cloves', 'tomatoes', 'chili powder', 'ground cumin', 'oregano', 'cayenne pepper', 'flour', 'water', 'monterey jack cheese', 'salt', 'all-purpose flour', 'baking powder', 'vegetable shortening', 'soy sauce', 'egg']","[3.0, 4.0, 1.0, 0.5, 2.0, 3.0, 1.0, 2.5, 1.0, 1.0, 0.5, 0.5, 0.25, 2.0, 0.25, 1.0, -1.0, 15.5, 5.5, 4.0, 4.0, 2.0, 1.375, 1.0, 1.0]","['unknown unit', 'tablespoons', 'unknown unit', 'lb', 'unknown unit', 'unknown unit', 'unknown unit', 'unknown unit', '1 lb', 'teaspoon', 'teaspoon', 'teaspoon', 'teaspoon', 'tablespoons', 'cup', 'cup', 'unknown unit', 'cups', 'tablespoons', 'tablespoons', 'tablespoons', 'teaspoons', 'cups', 'unknown unit', 'tablespoon']",8.0,41,22,"['medium carrots , scrub well', 'butter', 'large chopped onion', 'coarsely sliced mushrooms', 'medium zucchini , sliced 1/2 inch', 'stalks celery , sliced 1/2 inch', 'green pepper , cut in 1/2 inch squares', 'smashed and minced garlic cloves', 'can tomatoes (do not drain)', 'chili powder', 'ground cumin', 'oregano', 'cayenne pepper', 'flour', 'cold water', 'shredded monterey jack cheese', 'salt', 'sifted all-purpose flour or 3 1/2 cups whole wheat pastry flour', 'baking powder', 'chilled butter', 'chilled vegetable shortening', 'soy sauce', 'ice cold water', 'egg , mixed with', 'water']"
off the cob freezer corn,this recipe allows you the fresh taste of sweet corn-on-the cob all year long. i've been making it for years and will today make it with olathe corn i picked up at the market for 10 ears for $1. it stacks neatly in your freezer and is ready in a jiffy.,97052,51224,2004-08-05,"['time-to-make', 'course', 'main-ingredient', 'preparation', 'low-protein', '5-ingredients-or-less', 'side-dishes', 'vegetables', 'easy', 'freezer', 'dietary', 'low-sodium', 'oamc-freezer-make-ahead', 'low-in-something', 'corn', 'equipment', 'number-of-servings', '4-hours-or-less']","[517.2, 58.0, 29.0, 2.0, 17.0, 113.0, 14.0]",120,"['preheat oven to 325f', 'shuck ears of corn', 'rinse to remove silks', 'place on paper towels to drain', 'using an angel food cake pan and electric knife , stand each ear on tube part of pan and cut corn off cob', 'your cuttings will fall neatly into the pan', 'as the cake pan fills , empty into large roaster pan', 'season with salt and pepper to your taste', 'cube butter and distribute onto corn in roaster pan', 'pour half and half throughout corn', 'roast for 1 hour , stirring gently every 15 minutes', 'allow to cool for half an hour', 'label freezer bags with contents , quantity and date', 'ladle into bags at portions suitable for your personal use', 'stack neatly in freezer for later use']","['sweet corn', 'sweet butter', 'half-and-half', 'salt and pepper']","[35.0, 1.0, 1.0, -1.0]","['unknown unit', 'lb', 'pint', 'unknown unit']",12.0,15,4,"['ears sweet corn, cut raw off the cob', 'sweet butter', 'half-and-half', 'salt and pepper']"
one bowl perfect pound cake,"this is the perfect pound cake recipe...plus so easy to prepare and only one bowl to wash! this is a firm cake, so if you are into cutting and shaping cakes, this works well. i have used it for christening and communion cakes, creating crosses, etc and used buttercream frosting. i have also made it in a 9 x 13 cake pan...just adjust time accordingly. the addition of the yogurt really makes a difference in the taste.",26835,37305,2002-04-29,"['weeknight', 'time-to-make', 'course', 'main-ingredient', 'preparation', 'occasion', 'desserts', 'oven', 'easy', 'potluck', 'dinner-party', 'heirloom-historical', 'holiday-event', 'kid-friendly', 'picnic', 'vegetarian', 'cakes', 'grains', 'dietary', 'comfort-food', 'wedding', 'pasta-rice-and-grains', 'taste-mood', 'to-go', 'equipment', '4-hours-or-less']","[456.6, 32.0, 164.0, 15.0, 11.0, 63.0, 20.0]",70,"['preheat oven to 325 degrees and grease and flour a tube or bundt pan', 'combine all ingredients in a large bowl and blend at low speed', 'beat 3 minutes at medium speed', 'pour into prepared pan', 'bake for 1 hour or until top springs back when touched lightly in center', 'cool in pan for about 15 minutes then remove and cool completely on rack', 'serve plain or glaze if you like']","['all-purpose flour', 'sugar', 'salt', 'baking soda', 'lemon, rind of', 'vanilla', 'butter', 'yogurt', 'eggs']","[5.25, 2.0, 0.5, 0.5, 0.5, 1.0, 1.0, 1.0, 3.0]","['cups', 'cups', 'teaspoon', 'teaspoon', 'teaspoon', 'teaspoon', 'cup', '8 ounce', 'unknown unit']",11.0,7,9,"['all-purpose flour', 'sugar', 'salt', 'baking soda', 'grated lemon, rind of', 'vanilla', 'butter , softened', 'container yogurt (lemon, pineapple, orange, strawberry ""or"" vanilla)', 'large eggs , at room temperature']"
one pot brownies,"this recipe was submitted by mrs. stuart padnos for a cookbook fund raiser put out by members of the junior welfare league, holland, michigan about 30 or so years ago. my mom brought the cookbook back to me as a souvenir of their trip. i've made these brownies all these years and have great luck with them every time. i like to top them with an easy cooked chocolate fudge icing that i got from a bowling partner several years ago. these brownies are like a chocolate cake-not gooey like some recipes and i do personally like them plain without nuts or raisins.",32271,41809,2002-06-25,"['60-minutes-or-less', 'time-to-make', 'course', 'main-ingredient', 'preparation', 'desserts', 'easy', 'cookies-and-brownies', 'chocolate', 'bar-cookies', 'brownies', 'dietary']","[1389.5, 129.0, 410.0, 26.0, 42.0, 211.0, 51.0]",40,"['melt chocolate and butter in heavy pot', 'let cool slightly , then add sugar and mix well', 'add eggs , mix well , then beat in flour', 'add vanilla', 'add nuts or raisins , if desired', 'stir well', 'bake in 9 1 / 2 x 13 inch greased pan for 20-25 minutes at 375 degrees', 'do not overbake']","['unsweetened chocolate squares', 'butter', 'sugar', 'eggs', 'flour', 'vanilla', 'nuts']","[4.0, 0.5, 2.0, 4.0, 5.5, 2.0, 1.0]","['ounces', 'lb', 'cups', 'unknown unit', 'cups', 'teaspoons', 'cup']",5.0,8,7,"['unsweetened chocolate squares', 'butter or 1/2 lb margarine', 'sugar', 'eggs', 'flour', 'vanilla', 'chopped nuts or 1 cup raisins , if desired']"
open sesame noodles,"this is a very versatile and widely enjoyed pasta dish with chicken. it has an asian influence with a very nice sesame flavor. i whipped it up one evening with a limited pantry and my little one named it. joint collaboration on this one, folks! oh yea, and the key is with the fresh ginger.",107229,173674,2004-12-30,"['30-minutes-or-less', 'time-to-make', 'course', 'main-ingredient', 'cuisine', 'preparation', 'main-dish', 'asian', 'easy', 'diabetic', 'kosher', 'dietary', 'pasta-rice-and-grains']","[617.5, 34.0, 13.0, 20.0, 56.0, 18.0, 24.0]",28,"['cook pasta in salted water until al dente', 'drain', 'steam broccoli , set aside', 'whisk next 6 ingredients together in large serving bowl', 'add hot pasta', 'stir in onions , broccoli , and chicken', 'toss in cilantro', 'sprinkle on sesame seeds']","['vermicelli', 'rice vinegar', 'reduced sodium soy sauce', 'vegetable oil', 'fresh ginger', 'chili-garlic sauce', 'sesame oil', 'green onions', 'broccoli', 'cooked chicken', 'fresh cilantro', 'sesame seeds']","[16.0, 0.125, 0.25, 2.0, 2.0, 2.0, 0.25, 10.5, 1.0, 2.0, 0.5, 1.0]","['ounces', 'cup', 'cup', 'tablespoons', 'tablespoons', 'tablespoons', 'cup', 'cups', 'cup', 'cups', 'unknown unit', 'tablespoon']",5.0,8,12,"['vermicelli', 'rice vinegar', 'reduced sodium soy sauce', 'vegetable oil', 'grated fresh ginger', 'chili-garlic sauce', 'sesame oil', 'sliced green onions', 'broccoli', 'diced cooked chicken', 'chopped fresh cilantro', 'sesame seeds (to sprinkle on top)']"
philly waldorf salad,,5060,1534,1999-12-01,"['60-minutes-or-less', 'time-to-make', 'course', 'cuisine', 'preparation', 'north-american', 'low-protein', 'salads', 'american', 'easy', 'dietary', 'low-sodium', 'low-in-something', '3-steps-or-less']","[180.7, 22.0, 29.0, 3.0, 6.0, 33.0, 3.0]",60,"['combine softened cream cheese , orange juice , orange rind and sugar , mixing until well blended', 'add remaining ingredients', 'mix lightly', 'chill']","['philadelphia cream cheese', 'orange juice', 'orange rind', 'sugar', 'apples', 'celery', 'pecans']","[1.0, 2.0, 1.0, 1.0, 3.0, 1.0, 0.5]","['8 ounce', 'tablespoons', 'tablespoon', 'tablespoon', 'cups', 'cup', 'cup']",8.0,4,7,"['package Philadelphia Cream Cheese', 'orange juice', 'orange rind, grated', 'sugar', 'apples , chopped', 'celery , chopped', 'pecans , chopped']"
pick me up party chicken kabobs,serve as an appetizer or party pick-up food.,42570,6164,2002-10-07,"['30-minutes-or-less', 'time-to-make', 'course', 'main-ingredient', 'preparation', 'very-low-carbs', 'appetizers', 'lunch', 'side-dishes', 'poultry', 'chicken', 'dietary', 'high-protein', 'low-carb', 'high-in-something', 'low-in-something', 'meat', 'chicken-breasts']","[213.6, 24.0, 0.0, 26.0, 31.0, 16.0, 0.0]",30,"['combine all ingredients in a non-reactive bowl', 'cover and refrigerate overnight', 'place the chicken on skewers', 'grill until tender', 'serve warm']","['boneless chicken breast', 'garlic', 'salt', 'cumin', 'paprika', 'thyme', 'olive oil', 'lemon juice', 'cayenne', 'fresh ground pepper']","[1.0, 2.0, 5.5, 0.5, 1.0, 0.5, 4.0, 1.0, 0.125, -1.0]","['lb', 'teaspoons', 'teaspoons', 'teaspoon', 'teaspoon', 'teaspoon', 'tablespoons', 'tablespoon', 'teaspoon', 'unknown unit']",7.0,5,10,"['boneless chicken breast , diced', 'garlic , minced', 'salt', 'cumin', 'paprika', 'thyme', 'olive oil', 'lemon juice', 'cayenne', 'to taste fresh ground pepper']"
pizza stuffed potato,,52443,1533,2003-01-28,"['30-minutes-or-less', 'time-to-make', 'course', 'main-ingredient', 'preparation', 'occasion', 'for-1-or-2', 'side-dishes', 'eggs-dairy', 'potatoes', 'vegetables', 'oven', 'easy', 'kid-friendly', 'cheese', 'dietary', 'gluten-free', 'free-of-something', 'equipment', 'number-of-servings']","[183.3, 12.0, 9.0, 15.0, 21.0, 23.0, 6.0]",25,"['preheat oven to 450 degrees', 'cut potato in half lengthwise', 'scoop out pulp from potato halves into a bowl , leaving 1 / 4-inch-thick shells', 'mash pulp and reserve shells', 'add 1 ounce mozzarella cheese , the tomato sauce , ricotta cheese , oregano and garlic powder to potato pulp and stir to combine', 'spoon half of potato mixture into each reserved shell', 'top each with half of the remaining mozzarella cheese and half of the parmesan cheese', 'set potato shells in 1-quart casserole and bake until thoroughly heated , about 10 minutes']","['baking potato', 'mozzarella cheese', 'tomato sauce', 'part-skim ricotta cheese', 'oregano leaves', 'garlic powder', 'parmesan cheese']","[1.0, 5.5, 0.25, 0.25, 0.125, 0.125, 2.0]","['unknown unit', 'ounces', 'cup', 'cup', 'teaspoon', 'teaspoon', 'teaspoons']",2.0,8,7,"['baking potato , baked (6 ounces)', 'mozzarella cheese , shredded,divided', 'tomato sauce', 'part-skim ricotta cheese', 'oregano leaves', 'garlic powder', 'grated parmesan cheese']"
pour over anything mushroom gravy,the name says it all...absolute must for all the mushroom lovers out there...smooth as silk gravy!!,35595,6164,2002-07-29,"['30-minutes-or-less', 'time-to-make', 'course', 'main-ingredient', 'cuisine', 'preparation', 'occasion', 'sauces', 'main-dish', 'condiments-etc', 'vegetables', 'asian', 'indian', 'easy', 'dinner-party', 'fall', 'holiday-event', 'kid-friendly', 'vegetarian', 'winter', 'dietary', 'christmas', 'seasonal', 'ramadan', 'savory-sauces', 'mushrooms', 'novelty']","[33.1, 0.0, 11.0, 0.0, 2.0, 0.0, 2.0]",20,"['in a small saucepan , saut onion and mushrooms in a small amount oil', 'mix dissolved cornstarch into a cup of vegetable broth', 'slowly add to onions and mushrooms', 'add the other ingredients too', 'check the seasonings and cook gently until thickened', 'use on vegetables , over cooked rice or noodles , in casseroles , or over mashed potatoes']","['onion', 'mushroom pieces', 'sodium-free vegetable broth', 'tomato puree', 'cornstarch', 'white wine', 'black pepper', 'tabasco sauce']","[0.5, 1.0, 1.0, 0.75, 1.0, 1.0, 0.5, 1.0]","['cup', 'cup', 'cup', 'cup', 'tablespoon', 'tablespoon', 'teaspoon', 'dash']",5.0,6,8,"['onion , chopped', 'fresh mushroom pieces (finely chopped or diced)', 'sodium-free vegetable broth', 'tomato puree', 'cornstarch (dissolved in little cold water)', 'white wine', 'black pepper', 'Tabasco sauce']"
put down your fork tuna and bean salad,"the story behind this comes from a simple recipe i had found, then made changes to make our own. my husband loved it so much the first time i made it i literally had to say to him ",108804,178452,2005-01-19,"['time-to-make', 'main-ingredient', 'preparation', 'seafood', 'easy', 'beginner-cook', 'fish', 'dietary', 'low-cholesterol', 'low-saturated-fat', 'low-calorie', 'low-carb', 'tuna', 'healthy-2', 'low-in-something', 'saltwater-fish', 'presentation', 'served-cold', '4-hours-or-less']","[227.2, 14.0, 8.0, 29.0, 40.0, 7.0, 4.0]",120,"['in salad bowl , combine oil , vinegar , garlic , salt , basil and black pepper', 'add beans , tuna , scallions and sweet pepper and toss', 'chill several hours for flavors to blend', 'to make a beautiful presentation , serve on a leaf of bibb lettuce']","['light olive oil', 'red wine vinegar', 'garlic', 'salt', 'fresh basil', 'black pepper', 'white kidney beans', 'albacore tuna in water', 'scallions', 'red sweet bell peppers', 'bibb lettuce']","[3.0, 2.0, 1.0, 0.5, 2.0, 0.25, 1.0, 1.0, 2.0, 0.25, 6.0]","['tablespoons', 'tablespoons', 'clove', 'teaspoon', 'tablespoons', 'teaspoon', '20 ounce', '13 ounce', 'unknown unit', 'unknown unit', 'leaves']",6.0,4,11,"['light olive oil or 3 tablespoons canola oil', 'red wine vinegar', 'garlic , minced', 'salt', 'fresh basil , minced', 'black pepper', 'can white kidney beans or (20 ounce) can great northern beans', 'can albacore tuna in water , drained and flaked', 'scallions , sliced', '1/4 cup yellow sweet bell peppers or 1/4 cup orange sweet bell pepper , chopped', 'bibb lettuce (optional)']"
